input,response
"How do you treat a nose fracture?","Apply ice to reduce swelling and keep the head elevated. Seek medical help to properly assess the fracture, and avoid trying to realign the nose yourself."
"What are the symptoms of dengue hemorrhagic fever?","Symptoms include severe abdominal pain, persistent vomiting, bleeding from the gums or nose, blood in vomit or stool, and difficulty breathing."
"How is Bell's palsy treated?","Bell's palsy is treated with corticosteroids, antiviral medications if a viral cause is suspected, and physical therapy to stimulate facial muscles."
"What are the symptoms of hepatitis A?","Symptoms of hepatitis A include fatigue, nausea, abdominal pain, jaundice, and dark urine. The infection usually resolves on its own but vaccination can prevent it."
"How is peripheral artery disease treated?","Peripheral artery disease (PAD) is treated with lifestyle changes like exercise, medications such as statins and antiplatelets, and in severe cases, surgical procedures."
"What are the symptoms of peripheral neuropathy?","Symptoms include numbness, tingling, burning sensations, and weakness in the hands and feet. It is often caused by diabetes or other conditions that affect the nerves."
"What is the treatment for hyperthyroidism?","Hyperthyroidism is treated with antithyroid medications, radioactive iodine, or surgery to remove part of the thyroid gland."
"What are the symptoms of endometriosis?","Symptoms include pelvic pain, heavy menstrual bleeding, pain during intercourse, and infertility. It can also cause digestive issues."
"What is the treatment for gallbladder inflammation?","Gallbladder inflammation (cholecystitis) is treated with antibiotics, pain relievers, and sometimes surgery to remove the gallbladder (cholecystectomy)."
"What are the symptoms of colon cancer?","Symptoms include changes in bowel habits, blood in the stool, abdominal pain, unexplained weight loss, and fatigue."
"What is the treatment for fibromyalgia?","Fibromyalgia is treated with medications such as pain relievers, antidepressants, and anticonvulsants, along with physical therapy and lifestyle changes."
"What are the symptoms of cataracts?","Symptoms of cataracts include blurry vision, difficulty seeing at night, sensitivity to light, and seeing 'halos' around lights."
"What is the treatment for varicose veins?","Varicose veins are treated with compression stockings, lifestyle changes, and in some cases, surgical procedures like sclerotherapy or laser treatments."
