input,response
"What are the symptoms of diabetes?","Common symptoms of diabetes include increased thirst, frequent urination, fatigue, and blurred vision."
"How is hypertension treated?","Hypertension is treated with lifestyle changes such as diet and exercise, and medications like ACE inhibitors, beta-blockers, or diuretics."
"What is insulin and what does it do?","Insulin is a hormone produced by the pancreas that regulates blood sugar levels by facilitating the uptake of glucose into cells."
"Can stress affect heart health?","Yes, chronic stress can increase the risk of heart disease by raising blood pressure and cholesterol levels."
"What are the side effects of antibiotics?","Common side effects of antibiotics include nausea, diarrhea, allergic reactions, and yeast infections."
"How is asthma diagnosed?","Asthma is diagnosed through lung function tests like spirometry, along with a medical history review and physical examination."
"What is a common treatment for seasonal allergies?","Common treatments include antihistamines, nasal corticosteroids, decongestants, and allergy shots."
"How is depression diagnosed?","Depression is diagnosed through clinical evaluation, including a detailed medical history, a psychological examination, and sometimes questionnaires like the PHQ-9."
"What are the signs of a stroke?","Signs of a stroke include sudden numbness or weakness in the face, arm, or leg, especially on one side of the body, confusion, difficulty speaking, and trouble seeing."
"How do vaccines work?","Vaccines work by stimulating the immune system to recognize and fight pathogens like viruses and bacteria, preparing the body for future encounters."
"What are the risk factors for heart disease?","Risk factors for heart disease include high blood pressure, high cholesterol, smoking, obesity, physical inactivity, and a family history of heart disease."
"What is chemotherapy used for?","Chemotherapy is used to treat cancer by using drugs to kill or slow the growth of cancer cells."
"What are the symptoms of a migraine?","Migraine symptoms include severe headache, nausea, sensitivity to light and sound, and sometimes visual disturbances called auras."
"How is osteoporosis treated?","Osteoporosis is treated with medications like bisphosphonates, calcium and vitamin D supplements, and lifestyle changes such as exercise and quitting smoking."
"What are the common causes of anemia?","Anemia can be caused by iron deficiency, vitamin B12 deficiency, chronic diseases, or excessive blood loss."
"What is the role of hemoglobin in the body?","Hemoglobin is a protein in red blood cells that carries oxygen from the lungs to the rest of the body."
"How do you treat high cholesterol?","High cholesterol is treated with lifestyle changes such as a heart-healthy diet and exercise, and medications like statins."
"What are the symptoms of dehydration?","Symptoms of dehydration include dry mouth, thirst, dizziness, confusion, and decreased urine output."
"What is the function of the liver?","The liver processes nutrients from food, filters toxins from the blood, stores energy, and produces bile for digestion."
"Can high blood pressure cause kidney damage?","Yes, high blood pressure can damage blood vessels in the kidneys, leading to reduced kidney function or kidney failure."
"What is the common treatment for bacterial infections?","Bacterial infections are commonly treated with antibiotics such as penicillin, amoxicillin, or ciprofloxacin."
"How do blood thinners work?","Blood thinners work by reducing the blood's ability to form clots, helping to prevent stroke, heart attack, and other conditions caused by blood clots."
"What are the early signs of dementia?","Early signs of dementia include memory loss, difficulty with problem-solving, confusion about time and place, and changes in mood or behavior."
"How is cancer diagnosed?","Cancer is diagnosed through imaging tests like X-rays or CT scans, biopsies, blood tests, and physical examinations."
"What are the common treatments for cancer?","Common cancer treatments include surgery, chemotherapy, radiation therapy, immunotherapy, and targeted therapy."
"Can obesity lead to diabetes?","Yes, obesity is a major risk factor for type 2 diabetes as excess fat can lead to insulin resistance."
"What is the difference between a virus and bacteria?","Viruses are smaller than bacteria and require a host to replicate, while bacteria are single-celled organisms that can live in various environments, including within the human body."
"What is rheumatoid arthritis?","Rheumatoid arthritis is an autoimmune disorder where the immune system mistakenly attacks the joints, causing pain, swelling, and stiffness."
"What are common causes of liver disease?","Common causes of liver disease include hepatitis, excessive alcohol consumption, fatty liver disease, and genetic conditions."
"How is type 1 diabetes treated?","Type 1 diabetes is treated with insulin therapy, along with blood sugar monitoring, a balanced diet, and regular exercise."
"What is the role of the pancreas?","The pancreas produces digestive enzymes and hormones like insulin and glucagon, which help regulate blood sugar levels."
"What are the symptoms of a urinary tract infection?","Symptoms of a urinary tract infection include frequent urination, burning sensation when urinating, cloudy urine, and pelvic pain."
"How is epilepsy treated?","Epilepsy is treated with anti-seizure medications, dietary changes like the ketogenic diet, and in some cases, surgery."
"What is an autoimmune disease?","An autoimmune disease occurs when the immune system mistakenly attacks healthy cells in the body, leading to inflammation and tissue damage."
"How do you prevent osteoporosis?","Osteoporosis can be prevented by consuming adequate amounts of calcium and vitamin D, engaging in weight-bearing exercise, and avoiding smoking and excessive alcohol use."
"What are the symptoms of pneumonia?","Symptoms of pneumonia include cough with phlegm, fever, chills, shortness of breath, and chest pain."
"How is hypertension diagnosed?","Hypertension is diagnosed through blood pressure measurements taken over time, as well as a review of medical history and risk factors."
"Can dehydration cause headaches?","Yes, dehydration can lead to headaches as the body loses fluids, which can cause brain tissues to temporarily shrink, triggering pain receptors."
"What is COPD?","Chronic obstructive pulmonary disease (COPD) is a group of lung diseases, including emphysema and chronic bronchitis, that cause breathing difficulties and airflow obstruction."
"What are the symptoms of a heart attack?","Symptoms of a heart attack include chest pain, shortness of breath, nausea, lightheadedness, and pain in the jaw, neck, or arms."
"How is influenza treated?","Influenza is treated with rest, fluids, over-the-counter pain relievers, and antiviral medications like oseltamivir (Tamiflu) for severe cases."
"What are the complications of untreated hypertension?","Untreated hypertension can lead to complications such as heart attack, stroke, kidney damage, and vision loss."
"What is the function of the thyroid gland?","The thyroid gland regulates metabolism, energy levels, and growth through the production of hormones like thyroxine (T4) and triiodothyronine (T3)."
"What are the causes of chronic kidney disease?","Chronic kidney disease can be caused by diabetes, hypertension, glomerulonephritis, and polycystic kidney disease."
"How is bronchitis treated?","Bronchitis is treated with rest, fluids, pain relievers, cough suppressants, and sometimes antibiotics if it is bacterial in nature."
"What are the side effects of chemotherapy?","Side effects of chemotherapy include fatigue, nausea, vomiting, hair loss, and an increased risk of infections."
"Can anxiety cause physical symptoms?","Yes, anxiety can cause physical symptoms such as rapid heartbeat, sweating, dizziness, and gastrointestinal issues like nausea or diarrhea."
"What is multiple sclerosis?","Multiple sclerosis (MS) is a chronic autoimmune disease that affects the central nervous system, leading to muscle weakness, coordination issues, and vision problems."
"What are the symptoms of COVID-19?","Symptoms of COVID-19 include fever, cough, shortness of breath, fatigue, loss of taste or smell, and muscle aches."
"What should I do if someone is choking?","If someone is choking, encourage them to cough. If they cannot, perform the Heimlich maneuver by giving abdominal thrusts until the object is expelled."
"How do you treat a minor burn?","For a minor burn, cool the area under running water for 10-15 minutes, apply a sterile bandage, and avoid applying ice directly to the skin."
"What are the symptoms of a heart attack?","Symptoms of a heart attack include chest pain, shortness of breath, nausea, and pain that radiates to the arms, neck, or back."
"How should you treat a sprain?","Rest the injured area, apply ice to reduce swelling, use a compression bandage, and elevate the limb above the heart."
"What should you do if someone faints?","If someone faints, lay them down on their back and raise their legs to improve blood flow to the brain. Ensure they are breathing and call for medical help if necessary."
"What is the proper first aid for a nosebleed?","Sit upright, lean forward slightly, and pinch the soft part of the nose for 10-15 minutes. Avoid tilting the head back to prevent swallowing blood."
"What are the symptoms of shock?","Symptoms of shock include pale, cool, clammy skin, rapid breathing, a weak pulse, dizziness, and confusion. Immediate medical attention is required."
"How do you treat a cut or laceration?","Clean the wound with water, apply pressure to stop bleeding, and cover it with a sterile bandage. Seek medical help if the wound is deep or won't stop bleeding."
"What should you do in case of heatstroke?","Move the person to a cool place, remove excess clothing, and cool them down with water or fans. Seek immediate medical help as heatstroke is life-threatening."
"How can you recognize a stroke?","Use the FAST acronym: Face drooping, Arm weakness, Speech difficulties, and Time to call emergency services if any of these signs are present."
"How do you treat an insect bite or sting?","Wash the area with soap and water, apply a cold compress to reduce swelling, and use antihistamines to relieve itching. Seek medical attention if there's an allergic reaction."
"What should you do if someone is having a seizure?","Do not restrain them. Protect their head, remove objects they could injure themselves on, and stay with them until the seizure ends. Seek medical help if the seizure lasts longer than 5 minutes."
"What are the signs of dehydration?","Signs of dehydration include dry mouth, extreme thirst, fatigue, dizziness, and dark-colored urine."
"How do you perform CPR?","Perform CPR by giving 30 chest compressions at a rate of 100-120 compressions per minute, followed by 2 rescue breaths. Repeat until medical help arrives."
"How do you treat a fracture?","Immobilize the injured area, apply a splint if possible, and avoid moving the limb. Seek immediate medical attention."
"What should you do in case of a snake bite?","Keep the victim calm and immobilize the bitten limb at or below heart level. Do not apply ice or a tourniquet. Seek emergency medical help immediately."
"What is the first aid for a chemical burn?","Remove any contaminated clothing and rinse the affected area with cool running water for at least 20 minutes. Seek medical attention if the burn is severe."
"What are the symptoms of appendicitis?","Symptoms of appendicitis include sharp pain in the lower right abdomen, nausea, vomiting, and fever. It requires emergency surgery."
"How do you treat hypothermia?","Move the person to a warm place, remove wet clothing, and cover them with blankets. Avoid giving them alcohol or caffeine, and seek medical help."
"What should you do if someone is bleeding heavily?","Apply direct pressure to the wound with a clean cloth, raise the injured area above heart level, and seek emergency medical assistance."
"What are the signs of a concussion?","Signs of a concussion include headache, confusion, dizziness, nausea, memory problems, and sensitivity to light or noise."
"What is first aid for a broken bone?","Immobilize the area, apply a splint, and use ice to reduce swelling. Seek medical attention for proper treatment."
"How do you treat frostbite?","Move the person to a warm place, warm the affected area with warm (not hot) water, and avoid rubbing the skin. Seek medical help."
"What should you do if someone has a head injury?","Keep the person still, apply a cold compress to reduce swelling, and seek medical attention if there are signs of confusion, drowsiness, or vomiting."
"What are the signs of meningitis?","Signs of meningitis include a stiff neck, fever, headache, sensitivity to light, and confusion. It requires immediate medical attention."
"How is Lyme disease treated?","Lyme disease is treated with antibiotics, usually doxycycline or amoxicillin, for several weeks depending on the stage of the disease."
"What is malaria and how is it treated?","Malaria is a parasitic infection transmitted by mosquitoes. It is treated with antimalarial drugs such as chloroquine, artemisinin, or mefloquine."
"How is tuberculosis diagnosed?","Tuberculosis is diagnosed through a combination of chest X-rays, skin tests (Mantoux test), and sputum cultures."
"What are the symptoms of tuberculosis?","Symptoms of tuberculosis include a persistent cough, weight loss, night sweats, fever, and fatigue."
"How is measles treated?","There is no specific treatment for measles, but supportive care includes rest, fluids, and medications to reduce fever. Vaccination is the best prevention."
"What are the symptoms of chickenpox?","Chickenpox symptoms include an itchy rash that turns into fluid-filled blisters, fever, and fatigue."
"How is hepatitis B treated?","Hepatitis B is treated with antiviral medications like tenofovir or entecavir, and in some cases, liver transplant may be necessary for severe liver damage."
"What are the symptoms of hepatitis C?","Hepatitis C symptoms can include jaundice, fatigue, nausea, and abdominal pain. Some individuals may not show symptoms until liver damage occurs."
"What should you do in case of poisoning?","Call a poison control center immediately, do not induce vomiting unless instructed, and provide details about the substance ingested."
"What are the symptoms of whooping cough?","Symptoms of whooping cough include severe coughing fits followed by a high-pitched 'whoop' sound, vomiting, and difficulty breathing."
"What is the treatment for anaphylaxis?","Anaphylaxis is treated with an epinephrine injection, followed by emergency medical care to monitor the patient and prevent further complications."
"What is the treatment for a viral infection?","Most viral infections are treated with rest, fluids, and over-the-counter medications for symptom relief. Antiviral drugs may be used for specific conditions like influenza."
"What is tetanus and how is it prevented?","Tetanus is a bacterial infection caused by Clostridium tetani. It is prevented through vaccination and proper wound care."
"What are the symptoms of rubella?","Symptoms of rubella include a red rash, fever, swollen lymph nodes, and joint pain."
"What is the treatment for diphtheria?","Diphtheria is treated with antibiotics such as penicillin or erythromycin and an antitoxin to neutralize the diphtheria toxin."
"How is yellow fever prevented?","Yellow fever is prevented through vaccination and avoiding mosquito bites in areas where the virus is prevalent."
"How is rabies treated?","Rabies is treated with a series of rabies vaccinations and immune globulin injections administered immediately after exposure."
"What are the symptoms of Ebola?","Symptoms of Ebola include fever, severe headache, muscle pain, vomiting, diarrhea, and unexplained bleeding or bruising."
"How is cholera treated?","Cholera is treated with oral rehydration solutions to prevent dehydration and antibiotics in severe cases."
"What are the symptoms of dengue fever?","Symptoms of dengue fever include high fever, severe headache, pain behind the eyes, joint and muscle pain, and rash."
"What are the symptoms of Zika virus?","Symptoms of Zika virus include mild fever, rash, conjunctivitis, muscle pain, and headache. In pregnant women, it can cause birth defects."
"What is the treatment for mononucleosis?","Mononucleosis is treated with rest, fluids, and over-the-counter medications for pain and fever relief. It typically resolves on its own."
"What are the symptoms of hand, foot, and mouth disease?","Symptoms include fever, sore throat, painful sores on the hands, feet, and mouth, and loss of appetite."
"How is influenza prevented?","Influenza is prevented through annual vaccination, good hand hygiene, and avoiding close contact with infected individuals."
"What is the treatment for ringworm?","Ringworm is treated with topical antifungal medications such as clotrimazole or miconazole."
"What are the symptoms of bronchitis?","Symptoms of bronchitis include cough with mucus, fatigue, shortness of breath, and chest discomfort."
"How is chronic bronchitis treated?","Chronic bronchitis is treated with bronchodilators, corticosteroids, and oxygen therapy in severe cases. Lifestyle changes such as quitting smoking are crucial."
"What are the symptoms of cellulitis?","Symptoms of cellulitis include redness, swelling, warmth, and pain in the affected area of the skin. Fever and chills may also occur."
"How is cellulitis treated?","Cellulitis is treated with antibiotics, typically oral antibiotics like cephalexin or amoxicillin."
"What are the symptoms of psoriasis?","Psoriasis symptoms include red patches of skin covered with thick, silvery scales, dry skin, and itching or burning sensations."
"What is lupus and how is it treated?","Lupus is an autoimmune disease treated with anti-inflammatory medications, corticosteroids, and immunosuppressive drugs."
"How is celiac disease managed?","Celiac disease is managed by following a strict gluten-free diet, which involves avoiding foods containing wheat, barley, and rye."
"What are the symptoms of scabies?","Symptoms of scabies include intense itching, especially at night, and a pimple-like rash."
"What is the treatment for scabies?","Scabies is treated with topical medications such as permethrin cream or oral ivermectin."
"What should I do if someone has an allergic reaction?","If someone has a mild allergic reaction, give them an antihistamine. If they are experiencing severe symptoms like difficulty breathing, administer an epinephrine injection if available and seek emergency medical help."
"What are the early signs of diabetes?","The early signs of diabetes include frequent urination, increased thirst, unexplained weight loss, extreme fatigue, blurred vision, and slow healing of wounds."
"How is asthma managed during an attack?","During an asthma attack, use a rescue inhaler (albuterol) immediately, and if symptoms persist, seek emergency medical attention. Stay calm and try to control breathing by sitting upright."
"What is the treatment for high blood pressure?","High blood pressure (hypertension) is managed through lifestyle changes like reducing salt intake, regular exercise, and medications such as ACE inhibitors, beta-blockers, or diuretics."
"How do you treat a bee sting?","Remove the stinger by scraping it off, clean the area with soap and water, apply ice to reduce swelling, and take an antihistamine for itching or swelling."
"What are the symptoms of Lyme disease?","Symptoms of Lyme disease include fever, headache, fatigue, and a characteristic 'bullseye' rash. If untreated, it can affect joints, the heart, and the nervous system."
"What should you do in case of a drug overdose?","Call emergency services immediately. Try to keep the person awake, and if they're unconscious and not breathing, perform CPR. If you have naloxone (Narcan), administer it for opioid overdoses."
"What is the first aid for a drowning victim?","If safe to do so, pull the person out of the water and check for breathing. If they are not breathing, start CPR immediately. Call for emergency help."
"What are the symptoms of hypoglycemia?","Symptoms of hypoglycemia (low blood sugar) include shakiness, sweating, confusion, dizziness, and rapid heartbeat. Provide a quick source of sugar, such as juice or candy."
"How do you treat a blister?","If the blister is not painful, leave it intact to protect the underlying skin. If necessary, clean the area, sterilize a needle, and drain the fluid. Cover with a bandage."
"What are the symptoms of gallstones?","Symptoms of gallstones include sudden, severe pain in the upper right abdomen, nausea, vomiting, and possibly fever. It may require surgical removal."
"How is a urinary tract infection treated?","A urinary tract infection (UTI) is typically treated with antibiotics such as trimethoprim-sulfamethoxazole or nitrofurantoin. Drinking plenty of fluids can help flush the bacteria."
"What are the symptoms of anemia?","Symptoms of anemia include fatigue, weakness, pale skin, shortness of breath, dizziness, and cold hands or feet."
"How do you treat a dislocated joint?","Do not attempt to move the joint back into place. Immobilize the affected area, apply ice to reduce swelling, and seek immediate medical attention."
"What are the symptoms of a hernia?","Symptoms of a hernia include a bulge in the affected area, pain or discomfort, especially when bending over or lifting, and sometimes nausea."
"What is the treatment for gout?","Gout is treated with nonsteroidal anti-inflammatory drugs (NSAIDs), colchicine, and in some cases, corticosteroids. Lifestyle changes, such as reducing purine-rich foods, are also recommended."
"What are the symptoms of sleep apnea?","Symptoms of sleep apnea include loud snoring, episodes of stopped breathing during sleep, waking up with a dry mouth, morning headaches, and excessive daytime sleepiness."
"How is a concussion treated?","A concussion is treated with rest, both physical and cognitive. Avoid activities that require concentration or physical exertion until symptoms improve."
"What are the symptoms of pancreatic cancer?","Symptoms of pancreatic cancer include jaundice, weight loss, abdominal or back pain, and nausea. Early detection is difficult, and it often presents in advanced stages."
"How do you treat a toothache?","For a toothache, rinse the mouth with warm water, use dental floss to remove trapped food, and apply a cold compress if there is swelling. Over-the-counter pain relievers can help until a dentist is consulted."
"What is the first aid for electrical burns?","Turn off the source of electricity if possible, and do not touch the person if they are still in contact with the source. Call emergency services and cover any burns with a sterile gauze bandage."
"What are the symptoms of kidney stones?","Symptoms of kidney stones include severe pain in the side or back, pain during urination, blood in the urine, and nausea. Treatment may involve pain relief or surgical removal."
"What is the treatment for bacterial meningitis?","Bacterial meningitis is treated with intravenous antibiotics and sometimes corticosteroids. Immediate medical attention is required as it can be life-threatening."
"What are the symptoms of sepsis?","Symptoms of sepsis include fever, chills, rapid breathing, increased heart rate, confusion, and extreme pain or discomfort. It requires immediate medical treatment."
"How is deep vein thrombosis treated?","Deep vein thrombosis (DVT) is treated with anticoagulants (blood thinners) such as warfarin or direct oral anticoagulants. In some cases, clot removal procedures may be necessary."
"What is the treatment for scurvy?","Scurvy, caused by a deficiency of vitamin C, is treated by increasing dietary intake of vitamin C through fruits and vegetables or supplements."
"What are the symptoms of lupus?","Lupus symptoms vary but often include joint pain, skin rashes (especially a butterfly-shaped rash on the face), fatigue, fever, and kidney issues."
"How is Crohn's disease treated?","Crohn's disease is treated with anti-inflammatory medications, immune system suppressors, biologic drugs, and sometimes surgery to remove damaged parts of the digestive tract."
"What are the symptoms of a brain tumor?","Symptoms of a brain tumor include headaches, seizures, vision or speech problems, balance issues, and changes in mood or behavior."
"What is the treatment for shingles?","Shingles is treated with antiviral medications like acyclovir or valacyclovir, along with pain relievers and sometimes corticosteroids to reduce inflammation."
"What are the symptoms of a peptic ulcer?","Symptoms of a peptic ulcer include burning stomach pain, bloating, heartburn, and nausea. The pain often improves after eating or taking antacids."
"How is diverticulitis treated?","Diverticulitis is treated with antibiotics, a liquid diet, and sometimes surgery if complications like abscesses or perforations occur."
"What is the first aid for carbon monoxide poisoning?","Move the person to fresh air immediately and call emergency services. Administer oxygen if available, and seek medical attention as soon as possible."
"How is eczema treated?","Eczema is treated with moisturizing creams, topical corticosteroids, and in severe cases, oral medications like antihistamines or immunosuppressants."
"What are the symptoms of ovarian cancer?","Symptoms of ovarian cancer include bloating, pelvic or abdominal pain, difficulty eating, and frequent urination. Early-stage ovarian cancer may not show symptoms."
"What is the treatment for a herniated disc?","A herniated disc is treated with physical therapy, pain relievers, anti-inflammatory drugs, and sometimes surgery if nerve compression occurs."
